[
  {
    "id": "same-source-grain-v1",
    "requiresSameTerritoryVintage": true,
    "requiresSameAnalysisUnit": true,
    "allowAbsoluteDelta": false,
    "allowRelativeDelta": true,
    "onIncompatible": "reject",
    "messageKey": "comparison.sameSourceRequired"
  },
  {
    "id": "same-neighborhood-vintage-v1",
    "requiresSameTerritoryVintage": true,
    "requiresSameAnalysisUnit": true,
    "allowAbsoluteDelta": false,
    "allowRelativeDelta": true,
    "onIncompatible": "warn",
    "messageKey": "comparison.neighborhoodVintageWarning"
  },
  {
    "id": "municipality-aggregate-v1",
    "requiresSameTerritoryVintage": false,
    "requiresSameAnalysisUnit": false,
    "requiresSameTerritory": true,
    "requiresSameDomain": true,
    "requiresSameRound": true,
    "aggregationScope": "municipality",
    "allowAbsoluteDelta": true,
    "allowRelativeDelta": true,
    "onIncompatible": "reject",
    "messageKey": "comparison.policy.municipality"
  }
]
